{
  "name": "Example DSH Plugin",
  "repository": "https://github.com/example/dsh-plugin",
  "type": [
    "plugin"
  ],
  "categories": [
    "memory"
  ],
  "capabilities": [
    "persistent-memory"
  ],
  "runtime": [
    "dsh"
  ],
  "language": [
    "typescript"
  ],
  "license": "MIT",
  "status": "experimental",
  "official": false,
  "maintained": true,
  "description": "Example registry entry. Replace or remove this file when adding real projects."
}
